{
  "volumeProperty" : {
    "value" : 20.0,
    "unit" : "unit:cubicMetre"
  },
  "itemQuantityProperty" : {
    "value" : 20.0,
    "unit" : "unit:piece"
  },
  "areaProperty" : {
    "value" : 20.0,
    "unit" : "unit:squareCentimetre"
  },
  "countProperty" : {
    "value" : 20.0,
    "unit" : "unit:piece"
  },
  "massProperty" : {
    "value" : 20.0,
    "unit" : "unit:gram"
  },
  "linearProperty" : {
    "value" : 20.0,
    "unit" : "unit:millimetre"
  },
  "timeProperty" : {
    "value" : 20.0,
    "unit" : "unit:secondUnitOfTime"
  },
  "miscProperty" : {
    "value" : 20.0,
    "unit" : "unit:kilowattHour"
  }
}